"word","phonetic","part_of_speech_and_meanings","example_sentence","example_translation","audio_uk","audio_us"
"roast","[rəust]","vt.&vi.烤 炙 烘焙 adj.烘烤的 烤过的 n.烤肉 烘烤","She roasted the chicken for dinner.","她烤了鸡做晚餐。","https://dict.youdao.com/dictvoice?type=1&audio=roast","https://dict.youdao.com/dictvoice?type=2&audio=roast"
"rob","[rɔb]","vt.&vi.抢劫 劫掠","The bank was robbed yesterday.","昨天银行遭到抢劫。","https://dict.youdao.com/dictvoice?type=1&audio=rob","https://dict.youdao.com/dictvoice?type=2&audio=rob"
"robber","['rɔbə]","n.强盗 盗贼","The robber was caught by the police.","强盗被警察抓住了。","https://dict.youdao.com/dictvoice?type=1&audio=robber","https://dict.youdao.com/dictvoice?type=2&audio=robber"
"robbery","['rɔbəri]","n.抢劫 劫掠 盗取","The city has seen a rise in robberies.","该城市的抢劫案增加了。","https://dict.youdao.com/dictvoice?type=1&audio=robbery","https://dict.youdao.com/dictvoice?type=2&audio=robbery"
"robe","[rəub]","n.长袍 长衣 浴衣 v.(使)穿上长袍等","He put on a robe after bathing.","他洗完澡穿上长袍。","https://dict.youdao.com/dictvoice?type=1&audio=robe","https://dict.youdao.com/dictvoice?type=2&audio=robe"
"robot","['rəubɔt]","n.机器人 自动机","The factory uses robots to assemble cars.","工厂使用机器人组装汽车。","https://dict.youdao.com/dictvoice?type=1&audio=robot","https://dict.youdao.com/dictvoice?type=2&audio=robot"
"rock","[rɔk]","vt.摇 使动摇 使震惊 使动心 vi.摇来回 摇动 跳 摇摆舞 n","岩石 巨石 石头 摇滚乐 篮球","The earthquake rocked the city.","地震震动了城市。","https://dict.youdao.com/dictvoice?type=2&audio=rock"
"rocket","['rɔkit]","n.火箭 火箭发动机 烟火 v.发射 火箭 猛涨","The rocket launched successfully.","火箭成功发射。","https://dict.youdao.com/dictvoice?type=1&audio=rocket","https://dict.youdao.com/dictvoice?type=2&audio=rocket"
"rod","[rɔd]","n.杆 竿 棒 戒鞭 测量杆 视网膜杆状菌","He used a fishing rod to catch fish.","他用鱼竿钓鱼。","https://dict.youdao.com/dictvoice?type=1&audio=rod","https://dict.youdao.com/dictvoice?type=2&audio=rod"
"role","[rəul]","n.角色 作用 任务 影响程度","She played the role of Juliet in the play.","她在戏剧中扮演朱丽叶。","https://dict.youdao.com/dictvoice?type=1&audio=role","https://dict.youdao.com/dictvoice?type=2&audio=role"
"roll","[rəul]","n.卷 滚动 名单 压路机 颤音 vt.滚绕 转动 摇摆 展开 vi","滚 卷 绕 运载 完成 涌入","He rolled the ball down the hill.","他把球滚下山坡。","https://dict.youdao.com/dictvoice?type=2&audio=roll"
"roller","['rəulə]","n.滚柱 滚筒 滚轴 滚转机","The paint was applied with a roller.","油漆是用滚筒涂的。","https://dict.youdao.com/dictvoice?type=1&audio=roller","https://dict.youdao.com/dictvoice?type=2&audio=roller"
"Roman","[rɔmə]","n.古罗马人 罗马天主教会 罗马文字 adj.罗马的 罗马帝国的","The Roman Empire was vast.","罗马帝国疆域广阔。","https://dict.youdao.com/dictvoice?type=1&audio=Roman","https://dict.youdao.com/dictvoice?type=2&audio=Roman"
"romantic","[rə'mæntik]","adj.浪漫的 传奇的 n.浪漫的人","They had a romantic dinner by the sea.","他们在海边度过浪漫晚餐。","https://dict.youdao.com/dictvoice?type=1&audio=romantic","https://dict.youdao.com/dictvoice?type=2&audio=romantic"
"roof","[ru:f]","n.屋顶 车顶 顶 顶盖 vt.给...覆以屋顶 覆盖","The roof was repaired after the storm.","暴风雨后屋顶被修好了。","https://dict.youdao.com/dictvoice?type=1&audio=roof","https://dict.youdao.com/dictvoice?type=2&audio=roof"
"room","[ru:m]","n.房间 空间 地位 余地","There is plenty of room in the house.","房子里有足够的空间。","https://dict.youdao.com/dictvoice?type=1&audio=room","https://dict.youdao.com/dictvoice?type=2&audio=room"
"root","[ru:t]","n.根 根子 根源 祖先 vi.生根 扎根 翻寻 起源于","The tree's roots are deep.","这棵树的根很深。","https://dict.youdao.com/dictvoice?type=1&audio=root","https://dict.youdao.com/dictvoice?type=2&audio=root"
"rope","[rəup]","n.绳 索 v.捆绑","He tied the box with a rope.","他用绳子绑住盒子。","https://dict.youdao.com/dictvoice?type=1&audio=rope","https://dict.youdao.com/dictvoice?type=2&audio=rope"
"rose","[rəuz]","n.蔷薇花 蔷薇科植物 玫瑰 v.(rise的过去式)起立 上升 升起 adj.玫瑰色的 玫瑰的","She received a bouquet of roses.","她收到了一束玫瑰花。","https://dict.youdao.com/dictvoice?type=1&audio=rose","https://dict.youdao.com/dictvoice?type=2&audio=rose"
"rot","[rɔt]","vt.烂 腐坏 腐烂 腐蚀 败坏 n.腐烂 使...枯朽 衰弱","The fruit began to rot in the sun.","水果在太阳下开始腐烂。","https://dict.youdao.com/dictvoice?type=1&audio=rot","https://dict.youdao.com/dictvoice?type=2&audio=rot"
"rotary","['rəutəri]","adj.旋转的 转动的 n.旋转式机器 环形交叉路","The rotary engine works differently from a piston engine.","旋转式发动机的工作方式不同于活塞发动机。","https://dict.youdao.com/dictvoice?type=1&audio=rotary","https://dict.youdao.com/dictvoice?type=2&audio=rotary"
"rotate","[rəu'teit]","vi.旋转 vt.使旋转 轮流 adj.车轮状的","The earth rotates on its axis.","地球绕其轴旋转。","https://dict.youdao.com/dictvoice?type=1&audio=rotate","https://dict.youdao.com/dictvoice?type=2&audio=rotate"
"rotation","[rəu'teiʃən]","n.旋转 转动 循环","Crop rotation improves soil fertility.","轮作提高土壤肥力。","https://dict.youdao.com/dictvoice?type=1&audio=rotation","https://dict.youdao.com/dictvoice?type=2&audio=rotation"
"rotten","['rɔtn]","adj.腐烂的 腐朽的 发臭的","The apples are rotten.","苹果烂了。","https://dict.youdao.com/dictvoice?type=1&audio=rotten","https://dict.youdao.com/dictvoice?type=2&audio=rotten"
"rough","[rʌf]","adj.表面不平的 粗略的 粗糙的 粗暴的 艰难的 讨厌的 不适的 adv.粗鲁地 粗略地 n.高低不平且杂草丛生的地区 草图 暴徒 vt.殴打 草拟","The road is rough and full of potholes.","这条路崎岖不平，坑坑洼洼。","https://dict.youdao.com/dictvoice?type=1&audio=rough","https://dict.youdao.com/dictvoice?type=2&audio=rough"
"roughly","[rʌfli]","adv.粗糙地 粗略地 概略地 粗鲁地","He estimated roughly how many people would attend.","他大致估计会有多少人参加。","https://dict.youdao.com/dictvoice?type=1&audio=roughly","https://dict.youdao.com/dictvoice?type=2&audio=roughly"
"round","[raund]","adj.圆的 微胖的 完整的 坦率的 圆满完成的 n.兜圈 圆(某种圆形)交谊舞 常规活动 一局(轮) adv.环形地 vt.弄圆 绕行 使...完全 使成为整数 vi.变圆(胖) 弯曲 prep.围绕 遍及","They sat in a round table discussion.","他们参加圆桌讨论。","https://dict.youdao.com/dictvoice?type=1&audio=round","https://dict.youdao.com/dictvoice?type=2&audio=round"
"rouse","[rauz]","vt.唤醒 唤起 惊起 鼓舞 激起 n.觉醒 奋起","The speech roused the audience to action.","演讲激励了观众行动起来。","https://dict.youdao.com/dictvoice?type=1&audio=rouse","https://dict.youdao.com/dictvoice?type=2&audio=rouse"
"route","[ru:t]","n.路 路线 路程 航线 途径 vt.按路线发送 改变路线","We took a new route to avoid traffic.","我们走了一条新路线以避开交通。","https://dict.youdao.com/dictvoice?type=1&audio=route","https://dict.youdao.com/dictvoice?type=2&audio=route"
"routine","[ru:'ti:n]","n.例行公事 常规 无聊 adj.日常的 常规的 例行的 乏味的","He follows the same morning routine every day.","他每天遵循同样的晨间例行公事。","https://dict.youdao.com/dictvoice?type=1&audio=routine","https://dict.youdao.com/dictvoice?type=2&audio=routine"
"row","[rəu,rau]","n.(一)排 (一)行 船游 吵闹 vt.划船 成排 vi.划船 吵架","They rowed across the lake.","他们划船渡过湖面。","https://dict.youdao.com/dictvoice?type=1&audio=row","https://dict.youdao.com/dictvoice?type=2&audio=row"
"royal","['rɔiəl]","adj.王室的 皇家的 盛大的 极度的 n.贵族 顶帆","The royal family attended the ceremony.","王室出席了仪式。","https://dict.youdao.com/dictvoice?type=1&audio=royal","https://dict.youdao.com/dictvoice?type=2&audio=royal"
"rub","[rʌb]","vt.摩擦 擦 搓 涂抹上 使不愉快 vi.摩擦 n.摩擦 困难 障碍","He rubbed his eyes tiredly.","他疲惫地揉眼睛。","https://dict.youdao.com/dictvoice?type=1&audio=rub","https://dict.youdao.com/dictvoice?type=2&audio=rub"
"rubber","['rʌbə]","n.橡皮(擦子) 橡胶 合成橡胶 adj.橡胶的","This shoe has a rubber sole.","这双鞋有橡胶鞋底。","https://dict.youdao.com/dictvoice?type=1&audio=rubber","https://dict.youdao.com/dictvoice?type=2&audio=rubber"
"rubbish","['rʌbiʃ]","n.垃圾 废物 废话","Don't throw rubbish on the street.","不要往街上扔垃圾。","https://dict.youdao.com/dictvoice?type=1&audio=rubbish","https://dict.youdao.com/dictvoice?type=2&audio=rubbish"
"rude","[ru:d]","adj.加工粗糙的 粗野的 无礼的","It is rude to interrupt someone while speaking.","打断别人讲话是不礼貌的。","https://dict.youdao.com/dictvoice?type=1&audio=rude","https://dict.youdao.com/dictvoice?type=2&audio=rude"
"rug","[rʌg]","n.小地毯 地毯 毛毯 毯子 旅行毯","I bought a new rug for the living room.","我为客厅买了一个新地毯。","https://dict.youdao.com/dictvoice?type=1&audio=rug","https://dict.youdao.com/dictvoice?type=2&audio=rug"
"ruin","['ruin]","n.(pl.)废墟 毁灭 vt.毁坏 毁灭 vi.(使)破产 毁灭","The building was in ruins after the fire.","火灾后建筑物成了废墟。","https://dict.youdao.com/dictvoice?type=1&audio=ruin","https://dict.youdao.com/dictvoice?type=2&audio=ruin"
"rule","[ru:l]","n.统治 规定 规则 习惯 惯例 标准 vi.统治 立法 vt.裁决 统治 画直线","The teacher set strict rules for the classroom.","老师为课堂制定了严格的规则。","https://dict.youdao.com/dictvoice?type=1&audio=rule","https://dict.youdao.com/dictvoice?type=2&audio=rule"
"ruler","['ru:lə]","n.统治者 尺 直尺","He measured the table with a ruler.","他用尺子量桌子。","https://dict.youdao.com/dictvoice?type=1&audio=ruler","https://dict.youdao.com/dictvoice?type=2&audio=ruler"
"rumour","['ru:mə]","n.谣言 谣传 传闻 低语 vt.传闻 谣传","There is a rumour going around the school.","学校里流传着一个谣言。","https://dict.youdao.com/dictvoice?type=1&audio=rumour","https://dict.youdao.com/dictvoice?type=2&audio=rumour"
"run","[rʌn]","vi.跑 奔 行驶 流 竞赛 运转 遭遇 持续 熔化 褪色 蔓延 传播 vt.跑 放牧 经营 走私 使运转 浇铸 使遭受 n.奔跑 路程 趋向 adj.熔化的 浇铸的 洄游的","He runs every morning to stay fit.","他每天早上跑步保持健康。","https://dict.youdao.com/dictvoice?type=1&audio=run","https://dict.youdao.com/dictvoice?type=2&audio=run"
"runner","['rʌnə]","n.赛跑的人 跑步者","The runners lined up at the start line.","跑步者在起跑线上排队。","https://dict.youdao.com/dictvoice?type=1&audio=runner","https://dict.youdao.com/dictvoice?type=2&audio=runner"
"rural","['ru:rəl]","adj.农村的 田园的","She grew up in a rural village.","她在农村长大。","https://dict.youdao.com/dictvoice?type=1&audio=rural","https://dict.youdao.com/dictvoice?type=2&audio=rural"
"rush","[rʌʃ]","vi.冲(进) 奔 vt.催促 匆忙 猛冲 n.匆促 冲进 急流 猛冲 急需 突击 adj.紧急的","He rushed to catch the bus.","他赶忙去赶公交车。","https://dict.youdao.com/dictvoice?type=1&audio=rush","https://dict.youdao.com/dictvoice?type=2&audio=rush"
"Russian","[rʌʃən]","adj.俄国的 俄罗斯的 n.俄国人 俄语","She is learning Russian at school.","她在学校学习俄语。","https://dict.youdao.com/dictvoice?type=1&audio=Russian","https://dict.youdao.com/dictvoice?type=2&audio=Russian"
"rust","[rʌst]","n.锈 vi.生锈 氧化 变成红棕色 vt.使...生锈 损害","The old bike is covered in rust.","旧自行车上满是锈。","https://dict.youdao.com/dictvoice?type=1&audio=rust","https://dict.youdao.com/dictvoice?type=2&audio=rust"
"rusty","[rʌsti]","adj.生锈的 变迟钝的","My French is a bit rusty after years of not speaking it.","多年不用，我的法语有些生疏。","https://dict.youdao.com/dictvoice?type=1&audio=rusty","https://dict.youdao.com/dictvoice?type=2&audio=rusty"
"sack","[sæk]","n.袋 麻袋 开除 劫掠 vt.解雇 劫掠 把...装入袋子","The workers were given the sack for striking.","工人因罢工被解雇。","https://dict.youdao.com/dictvoice?type=1&audio=sack","https://dict.youdao.com/dictvoice?type=2&audio=sack"
"sacred","['seikrid]","adj.上帝的 神圣的 受尊重的","This is a sacred place for the tribe.","这是部落的圣地。","https://dict.youdao.com/dictvoice?type=1&audio=sacred","https://dict.youdao.com/dictvoice?type=2&audio=sacred"
"sacrifice","['sækrifais]","n.牺牲 供奉 祭品 vt.牺牲 祭祀 贱卖 vi.献祭","They made a sacrifice to the gods.","他们向神献祭。","https://dict.youdao.com/dictvoice?type=1&audio=sacrifice","https://dict.youdao.com/dictvoice?type=2&audio=sacrifice"
"sad","[sæd]","adj.悲哀的 令人悲痛的 伤心的 不能令人满意的","She felt sad after hearing the news.","听到消息后她感到伤心。","https://dict.youdao.com/dictvoice?type=1&audio=sad","https://dict.youdao.com/dictvoice?type=2&audio=sad"
"saddle","['sædl]","n.鞍子 马鞍 车座 山脊 拖具 vt.装以马鞍 使负担 vi.装马鞍","He saddled his horse before riding.","他在骑马前给马备好鞍。","https://dict.youdao.com/dictvoice?type=1&audio=saddle","https://dict.youdao.com/dictvoice?type=2&audio=saddle"
"sadly","['sædli]","adv.悲痛地 悲哀地 悲惨地 悲伤地","She sighed sadly and left the room.","她悲伤地叹气然后离开了房间。","https://dict.youdao.com/dictvoice?type=1&audio=sadly","https://dict.youdao.com/dictvoice?type=2&audio=sadly"
"sadness","['sædnis]","n.悲痛 悲哀","The film filled her with sadness.","这部电影让她充满悲伤。","https://dict.youdao.com/dictvoice?type=1&audio=sadness","https://dict.youdao.com/dictvoice?type=2&audio=sadness"
"safe","[seif]","adj.安全的 谨慎的 n.保险箱","Keep your money in a safe.","把钱放在保险箱里。","https://dict.youdao.com/dictvoice?type=1&audio=safe","https://dict.youdao.com/dictvoice?type=2&audio=safe"
"safely","['seifli]","adv.安全地 可靠地","The children crossed the street safely.","孩子们安全地过了马路。","https://dict.youdao.com/dictvoice?type=1&audio=safely","https://dict.youdao.com/dictvoice?type=2&audio=safely"
"safety","['seifti]","n.安全 保险 安全设施 vt.保护","Safety is our top priority at work.","工作中安全是我们的首要任务。","https://dict.youdao.com/dictvoice?type=1&audio=safety","https://dict.youdao.com/dictvoice?type=2&audio=safety"
"sail","[seil]","n.帆 船 乘船航行 vi.(驾船)航行 vt.乘船航行 浮游 启航","The ship set sail at dawn.","船在黎明时启航。","https://dict.youdao.com/dictvoice?type=1&audio=sail","https://dict.youdao.com/dictvoice?type=2&audio=sail"
"sailor","['seilə]","n.水手 海员 水兵","The sailor navigated through the storm.","水手在风暴中驾驶船只。","https://dict.youdao.com/dictvoice?type=1&audio=sailor","https://dict.youdao.com/dictvoice?type=2&audio=sailor"
"saint","[seint]","n.圣人 圣徒 基督教徒 vt.把...封为圣人","He was canonized as a saint.","他被封为圣人。","https://dict.youdao.com/dictvoice?type=1&audio=saint","https://dict.youdao.com/dictvoice?type=2&audio=saint"
"sake","[seik]","n.缘故 理由 利益 好处","For the sake of your health, eat less sugar.","为了你的健康，少吃糖。","https://dict.youdao.com/dictvoice?type=1&audio=sake","https://dict.youdao.com/dictvoice?type=2&audio=sake"
"salad","['sæləd]","n.色拉 凉拌生菜 杂烩 莴苣 生菜","I made a fresh salad for lunch.","我做了一份新鲜的沙拉当午餐。","https://dict.youdao.com/dictvoice?type=1&audio=salad","https://dict.youdao.com/dictvoice?type=2&audio=salad"
"salary","['sæləri]","n.薪金 薪水 vt.给...薪水","She receives a monthly salary.","她每月领取薪水。","https://dict.youdao.com/dictvoice?type=1&audio=salary","https://dict.youdao.com/dictvoice?type=2&audio=salary"
"sale","[seil]","n.卖 削价出售 拍卖 销售额","The store is having a big sale this weekend.","商店这个周末有大促销。","https://dict.youdao.com/dictvoice?type=1&audio=sale","https://dict.youdao.com/dictvoice?type=2&audio=sale"
"salesman","['seilzmən]","n.售货员 推销员","The salesman explained the features of the car.","推销员解释了汽车的特点。","https://dict.youdao.com/dictvoice?type=1&audio=salesman","https://dict.youdao.com/dictvoice?type=2&audio=salesman"
"salt","[sɔ:lt]","n.盐 盐类 刺激 adj.含盐的 辛辣的 vt.加盐于 用盐腌","Add a pinch of salt to the soup.","给汤加一撮盐。","https://dict.youdao.com/dictvoice?type=1&audio=salt","https://dict.youdao.com/dictvoice?type=2&audio=salt"
"salute","[sə'lu:t]","n.招呼 行礼 vi.行礼 致意 问候","The soldiers saluted the officer.","士兵向军官敬礼。","https://dict.youdao.com/dictvoice?type=1&audio=salute","https://dict.youdao.com/dictvoice?type=2&audio=salute"
"same","[seim]","adj.同一的 相同的 adv.同样地 pron.同样的人或事","We are wearing the same dress.","我们穿了相同的衣服。","https://dict.youdao.com/dictvoice?type=1&audio=same","https://dict.youdao.com/dictvoice?type=2&audio=same"
"sample","['sæmpl]","n.样品 实例 标本 vt.采样 品尝 adj.样例的","The company sent a sample of the product.","公司寄来了一份产品样品。","https://dict.youdao.com/dictvoice?type=1&audio=sample","https://dict.youdao.com/dictvoice?type=2&audio=sample"
"sand","[sænd]","n.沙 沙子 沙滩 v.撒沙 以沙掩盖","The children played in the sand.","孩子们在沙滩上玩。","https://dict.youdao.com/dictvoice?type=1&audio=sand","https://dict.youdao.com/dictvoice?type=2&audio=sand"
"sandwich","['sændwitʃ]","n.三明治 vt.夹入 插入 夹在中间","I had a ham sandwich for lunch.","我午餐吃了火腿三明治。","https://dict.youdao.com/dictvoice?type=1&audio=sandwich","https://dict.youdao.com/dictvoice?type=2&audio=sandwich"
"sandy","['sændi]","adj.沙的 含沙的 沙地的 多沙的 沙色的 不稳固的","The beach has a sandy shore.","海滩有沙质海岸。","https://dict.youdao.com/dictvoice?type=1&audio=sandy","https://dict.youdao.com/dictvoice?type=2&audio=sandy"
"satellite","['sætəlait]","n.卫星 人造卫星 卫星城 随从","The satellite orbits the earth.","卫星绕地球运行。","https://dict.youdao.com/dictvoice?type=1&audio=satellite","https://dict.youdao.com/dictvoice?type=2&audio=satellite"
"satisfaction","[.sætis'fækʃən]","n.满意 快事 乐事 赔偿 妥善处理 确信","She expressed her satisfaction with the service.","她对服务表示满意。","https://dict.youdao.com/dictvoice?type=1&audio=satisfaction","https://dict.youdao.com/dictvoice?type=2&audio=satisfaction"
"satisfactory","[.sætis'fæktəri]","adj.令人满意的 良好的","The results are satisfactory.","结果令人满意。","https://dict.youdao.com/dictvoice?type=1&audio=satisfactory","https://dict.youdao.com/dictvoice?type=2&audio=satisfactory"
"satisfy","['sætisfai]","vt.满足 使满意 使...信服 vi.足够 取悦","The food satisfied his hunger.","食物满足了他的饥饿。","https://dict.youdao.com/dictvoice?type=1&audio=satisfy","https://dict.youdao.com/dictvoice?type=2&audio=satisfy"
"Saturday","['sætədi]","n.星期六","We are going hiking on Saturday.","我们星期六去徒步。","https://dict.youdao.com/dictvoice?type=1&audio=Saturday","https://dict.youdao.com/dictvoice?type=2&audio=Saturday"
"sauce","[sɔ:s]","n.调味汁 酱汁 无理的话(或举动) vt.给...调味 使...增加趣味 无理","Add some sauce to the pasta.","给意面加一些酱汁。","https://dict.youdao.com/dictvoice?type=1&audio=sauce","https://dict.youdao.com/dictvoice?type=2&audio=sauce"
"saucer","[sɔ:sə]","n.茶托 浅碟","Place the cup on the saucer.","把杯子放在茶托上。","https://dict.youdao.com/dictvoice?type=1&audio=saucer","https://dict.youdao.com/dictvoice?type=2&audio=saucer"
"sausage","['sɔ:sidʒ]","n.香肠 腊肠","I bought some sausages for breakfast.","我买了一些香肠当早餐。","https://dict.youdao.com/dictvoice?type=1&audio=sausage","https://dict.youdao.com/dictvoice?type=2&audio=sausage"
"save","[seiv]","vt.救 解救 节省 储蓄 保存 vi.节省 储蓄 救球 prep.除...之外 conj.除...之外只有 n.救援者 救球 节省","We should save water during the drought.","在干旱期间我们应节约用水。","https://dict.youdao.com/dictvoice?type=1&audio=save","https://dict.youdao.com/dictvoice?type=2&audio=save"
"saving","['seiviŋ]","n.搭救 挽救 节约 存款 (复数)savings:储蓄 金 存款","He deposited his savings in the bank.","他把存款存入银行。","https://dict.youdao.com/dictvoice?type=1&audio=saving","https://dict.youdao.com/dictvoice?type=2&audio=saving"
"saw","[sɔ:]","n.锯子 vt.锯 锯开 vbl.看见(see 的过去式)","He used a saw to cut the wood.","他用锯子锯木头。","https://dict.youdao.com/dictvoice?type=1&audio=saw","https://dict.youdao.com/dictvoice?type=2&audio=saw"
"say","[sei]","vt.说 说明 比如说 讲 表达 假设 指示 vi.说 n.发言权 adv.大约","I want to say something important.","我想说点重要的事。","https://dict.youdao.com/dictvoice?type=1&audio=say","https://dict.youdao.com/dictvoice?type=2&audio=say"
"scale","[skeil]","n.天平 磅秤 秤 鳞 刻度 衡量 数值范围 标度 比例 大小 v.依比例决定 攀登","The climbers scaled the mountain.","登山者攀登了那座山。","https://dict.youdao.com/dictvoice?type=1&audio=scale","https://dict.youdao.com/dictvoice?type=2&audio=scale"
"scan","[skæn]","vt.细看 浏览 扫描 详细调查 押韵 vi.押韵 n.扫描 押韵 细查","The doctor scanned the X-ray.","医生仔细检查了X光片。","https://dict.youdao.com/dictvoice?type=1&audio=scan","https://dict.youdao.com/dictvoice?type=2&audio=scan"
"scar","[skɑ:]","n.伤疤 伤痕 创伤 断崖 v.结疤 使...有伤痕 痊愈","The scar on his arm is still visible.","他手臂上的伤疤仍然清晰可见。","https://dict.youdao.com/dictvoice?type=1&audio=scar","https://dict.youdao.com/dictvoice?type=2&audio=scar"
"scarce","[skɛəs]","adj.缺乏的 希有的 不足的 罕见的","Food was scarce during the famine.","饥荒期间食物稀缺。","https://dict.youdao.com/dictvoice?type=1&audio=scarce","https://dict.youdao.com/dictvoice?type=2&audio=scarce"
"scarcely","['skɛəsli]","adv.仅仅 几乎不 简直没有 勉强","She could scarcely believe her eyes.","她几乎不敢相信自己的眼睛。","https://dict.youdao.com/dictvoice?type=1&audio=scarcely","https://dict.youdao.com/dictvoice?type=2&audio=scarcely"
"scare","[skɛə]","vt.惊吓(惊恐 惊慌) vi.受惊 n.惊吓(惊恐 惊慌)","The loud noise scared the children.","巨响吓到了孩子们。","https://dict.youdao.com/dictvoice?type=1&audio=scare","https://dict.youdao.com/dictvoice?type=2&audio=scare"
"scarf","[skɑ:f]","n.围巾 头巾 领带","She wore a red scarf around her neck.","她脖子上围着红色围巾。","https://dict.youdao.com/dictvoice?type=1&audio=scarf","https://dict.youdao.com/dictvoice?type=2&audio=scarf"
"scatter","['skætə]","vt.使消散 撒 散播 驱散 vi.分散 消散 n.散布 零星少量","The wind scattered the leaves.","风把树叶吹得满天飞。","https://dict.youdao.com/dictvoice?type=1&audio=scatter","https://dict.youdao.com/dictvoice?type=2&audio=scatter"
"scene","[si:n]","n.发生地点 道具 场景 情景","The scene of the accident was chaotic.","事故现场一片混乱。","https://dict.youdao.com/dictvoice?type=1&audio=scene","https://dict.youdao.com/dictvoice?type=2&audio=scene"
"scenery","['si:nəri]","n.舞台布景 风景 布景 背景","The mountains provided beautiful scenery.","群山提供了美丽的风景。","https://dict.youdao.com/dictvoice?type=1&audio=scenery","https://dict.youdao.com/dictvoice?type=2&audio=scenery"
"scent","[sent]","n.气味 香味 痕迹 香水 vt.闻出 发觉 使充满味道 得到暗示 vi.嗅闻","The scent of flowers filled the room.","花香弥漫了整个房间。","https://dict.youdao.com/dictvoice?type=1&audio=scent","https://dict.youdao.com/dictvoice?type=2&audio=scent"
"schedule","['skedʒul]","n.时间表 计划表 一览表 计划 vt.安排 计划 预定 编制目录","The train schedule is displayed at the station.","火车时刻表显示在车站。","https://dict.youdao.com/dictvoice?type=1&audio=schedule","https://dict.youdao.com/dictvoice?type=2&audio=schedule"
"scheme","[ski:m]","n.计划 规划 方案 诡计 阴谋 v.计画 设计 体系 结构 图谋","They devised a scheme to improve sales.","他们设计了一个提升销售的计划。","https://dict.youdao.com/dictvoice?type=1&audio=scheme","https://dict.youdao.com/dictvoice?type=2&audio=scheme"
"scholar","['skɔlə]","n.学者(尤指文学方面) 获奖学金的学生","He is a scholar of ancient literature.","他是古代文学的学者。","https://dict.youdao.com/dictvoice?type=1&audio=scholar","https://dict.youdao.com/dictvoice?type=2&audio=scholar"
