"word","phonetic","part_of_speech_and_meanings","example_sentence","example_translation","audio_uk","audio_us"
"lamp","[læmp]","n. 灯 发光或反射光的天体 灵光","She turned on the lamp to read at night.","她打开灯在晚上阅读。","https://dict.youdao.com/dictvoice?type=1&audio=lamp","https://dict.youdao.com/dictvoice?type=2&audio=lamp"
"land","[lænd]","n. 陆地 国土 土地; vi. 上岸 使靠岸 卸货 得到登陆","The ship finally landed at the harbor.","船最终在港口靠岸。","https://dict.youdao.com/dictvoice?type=1&audio=land","https://dict.youdao.com/dictvoice?type=2&audio=land"
"landing","[‘lændiŋ]","n. 上岸 登陆 着陆 楼梯平台 (动词 land 的现在分词)","The plane made a smooth landing.","飞机平稳着陆。","https://dict.youdao.com/dictvoice?type=1&audio=landing","https://dict.youdao.com/dictvoice?type=2&audio=landing"
"landlady","[‘lænd.leidi]","n. 女房东 女地主","The landlady greeted us warmly.","女房东热情地迎接我们。","https://dict.youdao.com/dictvoice?type=1&audio=landlady","https://dict.youdao.com/dictvoice?type=2&audio=landlady"
"landlord","[‘lændlɔ:d]","n. 地主 房东 店主","The landlord raised the rent.","房东提高了租金。","https://dict.youdao.com/dictvoice?type=1&audio=landlord","https://dict.youdao.com/dictvoice?type=2&audio=landlord"
"lane","[lein]","n. (乡间)小路 小巷 行车道 跑道","They walked down a narrow lane.","他们走在一条狭窄的小路上。","https://dict.youdao.com/dictvoice?type=1&audio=lane","https://dict.youdao.com/dictvoice?type=2&audio=lane"
"language","[‘læŋgwidʒ]","n. 语言 语言课程","Learning a new language can be fun.","学习一种新语言可以很有趣。","https://dict.youdao.com/dictvoice?type=1&audio=language","https://dict.youdao.com/dictvoice?type=2&audio=language"
"lantern","[‘læntən]","n. 提灯 灯笼 [建筑学]天窗 屋顶气窗","He carried a lantern through the dark street.","他拿着灯笼走过黑暗的街道。","https://dict.youdao.com/dictvoice?type=1&audio=lantern","https://dict.youdao.com/dictvoice?type=2&audio=lantern"
"lap","[læp]","n. 膝部 膝盖 一圈 一周 下摆 舐声; vt. 包围 抱...在膝上 重叠 舔 拍打 泼溅; vi. 重叠 围住 轻拍 舔","The child sat on her mother's lap.","孩子坐在母亲的膝上。","https://dict.youdao.com/dictvoice?type=1&audio=lap","https://dict.youdao.com/dictvoice?type=2&audio=lap"
"large","[lɑ:dʒ]","adj. 大的 巨大的 广泛的 强烈的 普遍的 大量的","They live in a large house.","他们住在一栋大房子里。","https://dict.youdao.com/dictvoice?type=1&audio=large","https://dict.youdao.com/dictvoice?type=2&audio=large"
"largely","[‘lɑ:dʒli]","adv. 大部分 大量地 主要地","The success was largely due to teamwork.","成功主要归功于团队合作。","https://dict.youdao.com/dictvoice?type=1&audio=largely","https://dict.youdao.com/dictvoice?type=2&audio=largely"
"laser","[‘leizə]","n. 激光 镭射","The doctor used a laser to treat the eye condition.","医生用激光治疗眼病。","https://dict.youdao.com/dictvoice?type=1&audio=laser","https://dict.youdao.com/dictvoice?type=2&audio=laser"
"last","[lɑ:st]","adj. 最后的 末尾的 最近的 晚了 迟到了; adv. 最后 最新; n. 最后来的人(或发生的事); v. 持续 持久 耐久","The meeting lasted two hours.","会议持续了两个小时。","https://dict.youdao.com/dictvoice?type=1&audio=last","https://dict.youdao.com/dictvoice?type=2&audio=last"
"late","[leit]","adj. 迟的 晚的 已故的; adv. 迟 很迟 晚 最近地","He arrived late to the party.","他晚到聚会。","https://dict.youdao.com/dictvoice?type=1&audio=late","https://dict.youdao.com/dictvoice?type=2&audio=late"
"lately","[‘leitli]","adv. 最近 不久前","I haven't seen her lately.","我最近没见到她。","https://dict.youdao.com/dictvoice?type=1&audio=lately","https://dict.youdao.com/dictvoice?type=2&audio=lately"
"later","[‘leitə]","adv. 后来 过一会儿 稍后 后来 迟到地; adj. 更迟的 后面的","I will call you later.","我稍后会给你打电话。","https://dict.youdao.com/dictvoice?type=1&audio=later","https://dict.youdao.com/dictvoice?type=2&audio=later"
"Latin","[‘lætin]","adj. 拉丁的 拉丁人的 拉丁语系国家的; n. 拉丁语 拉丁人","He studied Latin in school.","他在学校学习拉丁语。","https://dict.youdao.com/dictvoice?type=1&audio=Latin","https://dict.youdao.com/dictvoice?type=2&audio=Latin"
"latter","[‘lætə]","adj. (两者中)后者的 后面的","I prefer the latter option.","我更喜欢后者。","https://dict.youdao.com/dictvoice?type=1&audio=latter","https://dict.youdao.com/dictvoice?type=2&audio=latter"
"laugh","[lɑ:f]","vi. 笑 发笑; n. 笑(声) 笑料(复数) 娱乐","We laughed at the joke.","我们笑了那个笑话。","https://dict.youdao.com/dictvoice?type=1&audio=laugh","https://dict.youdao.com/dictvoice?type=2&audio=laugh"
"laughter","[‘lɑ:ftə]","n. 笑 笑声","Her laughter was contagious.","她的笑声很有感染力。","https://dict.youdao.com/dictvoice?type=1&audio=laughter","https://dict.youdao.com/dictvoice?type=2&audio=laughter"
"launch","[lɔ:ntʃ]","vt. & n. 发射 投射 发动 下水 开始 升天 汽艇","They will launch a new product next month.","他们下个月将推出新产品。","https://dict.youdao.com/dictvoice?type=1&audio=launch","https://dict.youdao.com/dictvoice?type=2&audio=launch"
"laundry","[‘lɔ:ndri]","n. 洗衣房 洗衣店 要洗的衣服","She put the laundry in the washing machine.","她把要洗的衣服放进洗衣机。","https://dict.youdao.com/dictvoice?type=1&audio=laundry","https://dict.youdao.com/dictvoice?type=2&audio=laundry"
"lavatory","[‘lævətəri]","n. 盥洗室 厕所","The lavatory is at the end of the hallway.","盥洗室在走廊尽头。","https://dict.youdao.com/dictvoice?type=1&audio=lavatory","https://dict.youdao.com/dictvoice?type=2&audio=lavatory"
"law","[lɔ:]","n. 法律 法令 起诉 法则 规律; vi. 起诉","Breaking the law has consequences.","违法会有后果。","https://dict.youdao.com/dictvoice?type=1&audio=law","https://dict.youdao.com/dictvoice?type=2&audio=law"
"lawn","[lɔ:n]","n. 草地 草坪 草场 上等细麻布","The kids are playing on the lawn.","孩子们在草坪上玩耍。","https://dict.youdao.com/dictvoice?type=1&audio=lawn","https://dict.youdao.com/dictvoice?type=2&audio=lawn"
"lawyer","[‘lɔ:jə]","n. 律师 法学家","The lawyer prepared the case thoroughly.","律师彻底准备了案件。","https://dict.youdao.com/dictvoice?type=1&audio=lawyer","https://dict.youdao.com/dictvoice?type=2&audio=lawyer"
"lay","[lei]","vt. 置放 铺设 设置 击 产卵 使平静 打赌 压平 罚款 设计; vi. 生蛋 打赌 全力以赴; n. 隐蔽处 计划 价格 生蛋 叙事诗 诗歌; adj. 世俗的 外行的","She laid the book on the table.","她把书放在桌子上。","https://dict.youdao.com/dictvoice?type=1&audio=lay","https://dict.youdao.com/dictvoice?type=2&audio=lay"
"layer","[‘leiə]","n. 层 层次 铺设者; vi. 分层; vt. 将某物堆积成层; n. 产卵鸡 [园艺] 压条; vt. [园艺] 用压条法使(嫩枝)生根","The cake has three layers.","蛋糕有三层。","https://dict.youdao.com/dictvoice?type=1&audio=layer","https://dict.youdao.com/dictvoice?type=2&audio=layer"
"layout","[‘leiaut]","n. 布局 安排 设计","The magazine's layout is very attractive.","这本杂志的排版很吸引人。","https://dict.youdao.com/dictvoice?type=1&audio=layout","https://dict.youdao.com/dictvoice?type=2&audio=layout"
"lazy","[‘leizi]","adj. 懒惰的 懒散的","He felt lazy on Sunday morning.","他星期天早晨感到懒散。","https://dict.youdao.com/dictvoice?type=1&audio=lazy","https://dict.youdao.com/dictvoice?type=2&audio=lazy"
"lead","[led"," li:d]","vt. 为...带路 领导 引导 带领 以铅接合 过...(的生活); n. 铅 铅制品 领引 榜样","She will lead the team to victory.","她将带领团队取得胜利。","https://dict.youdao.com/dictvoice?type=2&audio=lead"
"leader","[‘li:də]","n. 领袖 领导人 首领","The leader addressed the crowd.","领袖向人群发表讲话。","https://dict.youdao.com/dictvoice?type=1&audio=leader","https://dict.youdao.com/dictvoice?type=2&audio=leader"
"leadership","[‘li:dəʃip]","n. 领导 领导才干","Strong leadership is essential for success.","强有力的领导力是成功的关键。","https://dict.youdao.com/dictvoice?type=1&audio=leadership","https://dict.youdao.com/dictvoice?type=2&audio=leadership"
"leading","[‘li:diŋ]","adj. 指导的 领导的 最主要的 在前的; vbl. 领导 引领 以铅接合; n. 领导 疏导 铅板 [计算机] 行间空白","She is the leading expert in her field.","她是该领域的顶尖专家。","https://dict.youdao.com/dictvoice?type=1&audio=leading","https://dict.youdao.com/dictvoice?type=2&audio=leading"
"leaf","[li:f]","n.叶 叶子 树叶 页 活动桌板 花瓣; vt.翻页; vi.长叶子 翻页浏览","The tree's leaves turned yellow in autumn.","树的叶子在秋天变黄了。","https://dict.youdao.com/dictvoice?type=1&audio=leaf","https://dict.youdao.com/dictvoice?type=2&audio=leaf"
"league","[li:g]","n.同盟 联盟 联合会 社团","The countries formed a league for trade.","这些国家组建了一个贸易联盟。","https://dict.youdao.com/dictvoice?type=1&audio=league","https://dict.youdao.com/dictvoice?type=2&audio=league"
"leak","[li:k]","vi.漏 泄露 漏渗; n.漏洞","Water is leaking from the pipe.","水从管道漏出来。","https://dict.youdao.com/dictvoice?type=1&audio=leak","https://dict.youdao.com/dictvoice?type=2&audio=leak"
"lean","[li:n]","vi.倾斜 屈身 倚靠 依赖; vt.使倾斜; n.瘦肉 倾斜 弯曲; adj.瘦的 贫乏的 歉收的","He leaned against the wall.","他靠在墙上。","https://dict.youdao.com/dictvoice?type=1&audio=lean","https://dict.youdao.com/dictvoice?type=2&audio=lean"
"leap","[li:p]","vi.跳 跃 跳跃 猛冲; vt.跃过; n.跳跃 剧增 急变","The cat leaped over the fence.","猫跳过了栅栏。","https://dict.youdao.com/dictvoice?type=1&audio=leap","https://dict.youdao.com/dictvoice?type=2&audio=leap"
"learn","[lə:n]","vi.学 学习 了解 习得; vt.学 学习 获悉","She learns English quickly.","她学英语很快。","https://dict.youdao.com/dictvoice?type=1&audio=learn","https://dict.youdao.com/dictvoice?type=2&audio=learn"
"learned","['lə:nid]","adj.有学问的 博学的 学术上的; learn 的过去式和过去分词","He is a learned scholar.","他是一位博学的学者。","https://dict.youdao.com/dictvoice?type=1&audio=learned","https://dict.youdao.com/dictvoice?type=2&audio=learned"
"learning","['lə:niŋ]","n.学习 学问 知识; 动词 learn 的现在分词","Learning new skills is important.","学习新技能很重要。","https://dict.youdao.com/dictvoice?type=1&audio=learning","https://dict.youdao.com/dictvoice?type=2&audio=learning"
"least","[li:st]","adj.最少的 最小的; n. & adv.最少 最小","This is the least I can do.","这是我能做的最少的事。","https://dict.youdao.com/dictvoice?type=1&audio=least","https://dict.youdao.com/dictvoice?type=2&audio=least"
"leather","['leðə]","n.皮革 皮革制品; adj.皮革制的; vt.用皮革覆盖 鞭打","He bought a leather jacket.","他买了一件皮夹克。","https://dict.youdao.com/dictvoice?type=1&audio=leather","https://dict.youdao.com/dictvoice?type=2&audio=leather"
"leave","[li:v]","vi.离去 生出叶子; vt.离开 告假 遗留 听任 使处于某种状态; n.许可 准假 告别","She left the room quietly.","她安静地离开了房间。","https://dict.youdao.com/dictvoice?type=1&audio=leave","https://dict.youdao.com/dictvoice?type=2&audio=leave"
"lecture","['lektʃə]","n. & vi.演讲 讲课 教导 教训 斥责","The professor gave an interesting lecture.","教授做了一场有趣的演讲。","https://dict.youdao.com/dictvoice?type=1&audio=lecture","https://dict.youdao.com/dictvoice?type=2&audio=lecture"
"left","[left]","adj.左边的; adv.在左边; n.左边; p.p. of leave","Turn left at the corner.","在拐角向左转。","https://dict.youdao.com/dictvoice?type=1&audio=left","https://dict.youdao.com/dictvoice?type=2&audio=left"
"leg","[leg]","n.腿 腿部 支柱 裤脚管; vi.用脚走路","He broke his leg while skiing.","他滑雪时摔断了腿。","https://dict.youdao.com/dictvoice?type=1&audio=leg","https://dict.youdao.com/dictvoice?type=2&audio=leg"
"legal","['li:gəl]","adj.法律的 合法的 法定的","It is legal to drive at 18.","18岁开车是合法的。","https://dict.youdao.com/dictvoice?type=1&audio=legal","https://dict.youdao.com/dictvoice?type=2&audio=legal"
"legend","['ledʒənd]","n.传说 传奇 传奇人物 铭文 (地图或图片等的)说明 图例","The legend of King Arthur is famous.","亚瑟王的传说很有名。","https://dict.youdao.com/dictvoice?type=1&audio=legend","https://dict.youdao.com/dictvoice?type=2&audio=legend"
"leisure","['li:ʒə]","n.空闲时间 悠闲 闲暇 休闲","I enjoy reading in my leisure time.","我喜欢在空闲时间阅读。","https://dict.youdao.com/dictvoice?type=1&audio=leisure","https://dict.youdao.com/dictvoice?type=2&audio=leisure"
"lemon","['lemən]","n.柠檬 柠檬树","She squeezed a lemon into her tea.","她把一个柠檬挤进茶里。","https://dict.youdao.com/dictvoice?type=1&audio=lemon","https://dict.youdao.com/dictvoice?type=2&audio=lemon"
"lend","[lend]","vt.把...借给 贷(款) 给予 增添; vi.贷款","Can you lend me some money?","你能借我一些钱吗？","https://dict.youdao.com/dictvoice?type=1&audio=lend","https://dict.youdao.com/dictvoice?type=2&audio=lend"
"length","[leŋθ]","n.长 长度 一段 篇幅","The length of the river is 500 km.","这条河长500公里。","https://dict.youdao.com/dictvoice?type=1&audio=length","https://dict.youdao.com/dictvoice?type=2&audio=length"
"lens","[lenz]","n.透镜 镜片 镜头","He adjusted the camera lens.","他调整了相机镜头。","https://dict.youdao.com/dictvoice?type=1&audio=lens","https://dict.youdao.com/dictvoice?type=2&audio=lens"
"less","[les]","adj.更少的 更小的; adv.更少地 更小地; n.少量 次要; prep.减","She has less money than him.","她的钱比他少。","https://dict.youdao.com/dictvoice?type=1&audio=less","https://dict.youdao.com/dictvoice?type=2&audio=less"
"lessen","['lesn]","vt.减少 减轻 缩小 变小","The medicine lessened her pain.","药物减轻了她的疼痛。","https://dict.youdao.com/dictvoice?type=1&audio=lessen","https://dict.youdao.com/dictvoice?type=2&audio=lessen"
"lesson","['lesn]","n.功课 课 课程 教训; vt.给...上课 教训","Today's lesson was very informative.","今天的课非常有益。","https://dict.youdao.com/dictvoice?type=1&audio=lesson","https://dict.youdao.com/dictvoice?type=2&audio=lesson"
"lest","[lest]","conj. & prep.惟恐 以免","He spoke softly lest he wake the baby.","他轻声说话，以免吵醒宝宝。","https://dict.youdao.com/dictvoice?type=1&audio=lest","https://dict.youdao.com/dictvoice?type=2&audio=lest"
"let","[let]","vt.允许 让 使 释放; vi.出租 承包; n.障碍 擦网球","Let him go.","让他走吧。","https://dict.youdao.com/dictvoice?type=1&audio=let","https://dict.youdao.com/dictvoice?type=2&audio=let"
"letter","['letə]","n.信 证书 字母; v.写下 印刷; n.租赁人","I received a letter from my friend.","我收到朋友的信。","https://dict.youdao.com/dictvoice?type=1&audio=letter","https://dict.youdao.com/dictvoice?type=2&audio=letter"
"level","['levl]","n.水平面 水平 等级 标准 层次; adj.水平的 平坦的 齐平的 稳定的 合理的 满满的; vt.压平 使同等 瞄准 夷为平地 推翻 指责; vi.趋向平稳 瞄准 诚恳待人 使平等","The building has three levels.","这栋楼有三层。","https://dict.youdao.com/dictvoice?type=1&audio=level","https://dict.youdao.com/dictvoice?type=2&audio=level"
"lever","['levə]","n.杆 杠杆 控制杆 似杠杆之工具; vt.撬开 使用杠杆","He used a lever to lift the heavy stone.","他用杠杆撬起了沉重的石头。","https://dict.youdao.com/dictvoice?type=1&audio=lever","https://dict.youdao.com/dictvoice?type=2&audio=lever"
"liable","['laiəbl]","adj.易于...的 可能的 有义务的 应负责的 有...倾向","He is liable for the damages.","他对损害负责。","https://dict.youdao.com/dictvoice?type=1&audio=liable","https://dict.youdao.com/dictvoice?type=2&audio=liable"
"liar","['laiə]","n.说谎的人","He is a notorious liar.","他是个臭名昭著的说谎者。","https://dict.youdao.com/dictvoice?type=1&audio=liar","https://dict.youdao.com/dictvoice?type=2&audio=liar"
"liberal","['libərəl]","adj.心胸宽大的 慷慨的 无偏见的 不拘泥的 宽大的 开明的; n.自由主义者 宽容大度的人 (Liberal)自由党人","She has a liberal attitude towards new ideas.","她对新思想持开明态度。","https://dict.youdao.com/dictvoice?type=1&audio=liberal","https://dict.youdao.com/dictvoice?type=2&audio=liberal"
"liberate","['libəreit]","vt.解放释放 使获自由; v.解放 使获得自由 释出 放出","The soldiers liberated the town.","士兵们解放了这个城镇。","https://dict.youdao.com/dictvoice?type=1&audio=liberate","https://dict.youdao.com/dictvoice?type=2&audio=liberate"
"liberation","[.libə'reiʃən]","n.解放 解放运动 (为获得平等权利和地位的行为)","The liberation of the country was celebrated.","全国的解放受到了庆祝。","https://dict.youdao.com/dictvoice?type=1&audio=liberation","https://dict.youdao.com/dictvoice?type=2&audio=liberation"
"liberty","['libəti]","n.自由 释放 许可","Freedom of speech is a basic liberty.","言论自由是一项基本自由。","https://dict.youdao.com/dictvoice?type=1&audio=liberty","https://dict.youdao.com/dictvoice?type=2&audio=liberty"
"librarian","[lai'brɛəriən]","n.图书馆馆长","The librarian helped me find the book.","馆长帮我找到了那本书。","https://dict.youdao.com/dictvoice?type=1&audio=librarian","https://dict.youdao.com/dictvoice?type=2&audio=librarian"
"library","['laibrəri]","n.图书馆 藏书","I often go to the library to study.","我经常去图书馆学习。","https://dict.youdao.com/dictvoice?type=1&audio=library","https://dict.youdao.com/dictvoice?type=2&audio=library"
"license","['laisns]","n.许可 批准 执照 许可证; vt.准许 特许","He obtained a license to drive.","他获得了驾驶执照。","https://dict.youdao.com/dictvoice?type=1&audio=license","https://dict.youdao.com/dictvoice?type=2&audio=license"
"lick","[lik]","vt.舔 舔吃 连续击打 击败; vi.用舌头舔 拍打; n.舔 少许 打","The dog licked my hand.","狗舔了我的手。","https://dict.youdao.com/dictvoice?type=1&audio=lick","https://dict.youdao.com/dictvoice?type=2&audio=lick"
"lid","[lid]","n.盖子 盖 囊盖","She put the lid on the jar.","她把盖子盖上了罐子。","https://dict.youdao.com/dictvoice?type=1&audio=lid","https://dict.youdao.com/dictvoice?type=2&audio=lid"
"lie","[lai]","vi.躺 平放 位于 说谎 欺骗; n.谎言","He told a lie to avoid trouble.","他为了避免麻烦说了一个谎。","https://dict.youdao.com/dictvoice?type=1&audio=lie","https://dict.youdao.com/dictvoice?type=2&audio=lie"
"lieutenant","[lu:'tenənt]","n.陆军中尉 副职官员 助理人员","The lieutenant led the squad.","中尉带领了小队。","https://dict.youdao.com/dictvoice?type=1&audio=lieutenant","https://dict.youdao.com/dictvoice?type=2&audio=lieutenant"
"life","[laif]","n.生命 一生 寿命 生活 人生 生物 灵魂 无期徒刑; adj.活的 终身的 生动的","He dedicated his life to science.","他把一生献给了科学。","https://dict.youdao.com/dictvoice?type=1&audio=life","https://dict.youdao.com/dictvoice?type=2&audio=life"
"lifetime","['laiftaim]","n.一生 终身 寿命 使用期限","This watch is guaranteed for a lifetime.","这块手表保证终身使用。","https://dict.youdao.com/dictvoice?type=1&audio=lifetime","https://dict.youdao.com/dictvoice?type=2&audio=lifetime"
"lift","[lift]","vt.提起 提高 升高 举起 还清 取消 偷窃 运送; vi.提升; n.电梯 举起 帮助 提升 电梯载货量 扒窃 搭便车","She lifted the box onto the shelf.","她把箱子提到货架上。","https://dict.youdao.com/dictvoice?type=1&audio=lift","https://dict.youdao.com/dictvoice?type=2&audio=lift"
"light","[lait]","n.光 光线 灯光 源 启发 众所周知的通 光口 眼光; adj.轻的 不重要的 容易的 明亮的 淡色的 少量的; vi.点燃 着火 变亮 下马 落下 碰巧发生; vt.点燃 照亮; adv.轻地 轻便地","The room is filled with natural light.","房间充满了自然光。","https://dict.youdao.com/dictvoice?type=1&audio=light","https://dict.youdao.com/dictvoice?type=2&audio=light"
"lighten","['laitn]","vt.照亮 使明亮 点亮 变亮 减轻","The sun lightened the room.","阳光照亮了房间。","https://dict.youdao.com/dictvoice?type=1&audio=lighten","https://dict.youdao.com/dictvoice?type=2&audio=lighten"
"lightly","['laitli]","adv.轻轻地 轻松地 轻快地 轻蔑地 轻率地 轻微地","She tapped him lightly on the shoulder.","她轻轻拍了拍他的肩膀。","https://dict.youdao.com/dictvoice?type=1&audio=lightly","https://dict.youdao.com/dictvoice?type=2&audio=lightly"
"lightning","['laitniŋ]","n.闪电 闪电放电; adj.闪电般的 快速的; vi.打闪","The lightning struck the tree.","闪电击中了那棵树。","https://dict.youdao.com/dictvoice?type=1&audio=lightning","https://dict.youdao.com/dictvoice?type=2&audio=lightning"
"like","[laik]","vt.喜欢 喜爱 希望 愿意 想; adj.相似的 同样的; prep.像 如同 像要; n.爱好 类似的人(或物); adv.大概 和…一样; conj.如同","I like ice cream.","我喜欢冰淇淋。","https://dict.youdao.com/dictvoice?type=1&audio=like","https://dict.youdao.com/dictvoice?type=2&audio=like"
"likely","['laikli]","adj.可能的 合适的 可信的 有前途的 有吸引力的; adv.很可能","He is likely to win the game.","他很可能赢得比赛。","https://dict.youdao.com/dictvoice?type=1&audio=likely","https://dict.youdao.com/dictvoice?type=2&audio=likely"
"likewise","['laikwaiz]","adv.同样地 也 又 此外 (表示感觉相同) 我也是","She smiled, and I did likewise.","她微笑，我也同样微笑。","https://dict.youdao.com/dictvoice?type=1&audio=likewise","https://dict.youdao.com/dictvoice?type=2&audio=likewise"
"limb","[lim]","n.肢 臂 翼 树枝 四肢 枝干 边缘; vt.切断手足 切断树干","The tree's limbs were heavy with snow.","树枝上积雪很重。","https://dict.youdao.com/dictvoice?type=1&audio=limb","https://dict.youdao.com/dictvoice?type=2&audio=limb"
"lime","[laim]","n.石灰 酸橙 酸橙树 粘鸟胶 钙; vt.施石灰 涂上 粘性物质 沾上粘鸟胶; adj.与石灰或石灰石相关","They used lime to treat the soil.","他们用石灰处理土壤。","https://dict.youdao.com/dictvoice?type=1&audio=lime","https://dict.youdao.com/dictvoice?type=2&audio=lime"
"limit","['limit]","n.限度 限制 范围; vt.限制 限定","Speed limits are strictly enforced.","速度限制被严格执行。","https://dict.youdao.com/dictvoice?type=1&audio=limit","https://dict.youdao.com/dictvoice?type=2&audio=limit"
"limitation","[.limi'teiʃən]","n.限制 限度 局限","The project has some limitations.","该项目有一些局限性。","https://dict.youdao.com/dictvoice?type=1&audio=limitation","https://dict.youdao.com/dictvoice?type=2&audio=limitation"
"limited","['limitid]","adj.有限的 被限制住的 缺乏创新性的","We have a limited amount of time.","我们时间有限。","https://dict.youdao.com/dictvoice?type=1&audio=limited","https://dict.youdao.com/dictvoice?type=2&audio=limited"
"line","[lain]","n.线 排 路线 线条 行 航线 场界 皱纹 家族; v.用做衬里 排成一行 顺…排列; vi.排成一行 顺…排列 划线于","The artist drew a straight line.","艺术家画了一条直线。","https://dict.youdao.com/dictvoice?type=1&audio=line","https://dict.youdao.com/dictvoice?type=2&audio=line"
"linen","['linin]","n.亚麻布 亚麻线 亚麻织物 亚麻制品; adj.亚麻布制的 亚麻的","The tablecloth is made of linen.","桌布是亚麻制的。","https://dict.youdao.com/dictvoice?type=1&audio=linen","https://dict.youdao.com/dictvoice?type=2&audio=linen"
"liner","['lainə]","n.班船 班轮 班机","She traveled on an ocean liner.","她乘坐班轮旅行。","https://dict.youdao.com/dictvoice?type=1&audio=liner","https://dict.youdao.com/dictvoice?type=2&audio=liner"
"link","[liŋk]","vt.有环连接 连接 联系; n.环 环节 联系 (链的)环圈","The chain links are made of steel.","链条环是钢制的。","https://dict.youdao.com/dictvoice?type=1&audio=link","https://dict.youdao.com/dictvoice?type=2&audio=link"
"lion","['laiən]","n.狮子 勇猛的人","The lion is the king of the jungle.","狮子是丛林之王。","https://dict.youdao.com/dictvoice?type=1&audio=lion","https://dict.youdao.com/dictvoice?type=2&audio=lion"
"lip","[lip]","n.嘴唇","He kissed her on the lips.","他吻了她的嘴唇。","https://dict.youdao.com/dictvoice?type=1&audio=lip","https://dict.youdao.com/dictvoice?type=2&audio=lip"
"liquid","['likwid]","n.液体; adj.液体的 液态的","Water is a liquid at room temperature.","水在室温下是液体。","https://dict.youdao.com/dictvoice?type=1&audio=liquid","https://dict.youdao.com/dictvoice?type=2&audio=liquid"
"liquor","['likə]","n.酒 溶液 液剂","He bought some liquor for the party.","他为聚会买了些酒。","https://dict.youdao.com/dictvoice?type=1&audio=liquor","https://dict.youdao.com/dictvoice?type=2&audio=liquor"
