"word","phonetic","part_of_speech_and_meanings","example_sentence","example_translation","audio_uk","audio_us"
"dictionary","['dikʃəneri]","n. 词典 字典 辞典","I looked up the word in the dictionary.","我在词典里查了这个词。","https://dict.youdao.com/dictvoice?type=1&audio=dictionary","https://dict.youdao.com/dictvoice?type=2&audio=dictionary"
"die","[dai]","vi. 死 死亡 灭亡; n. 金属模子 印模 骰子","Many soldiers died in the battle.","许多士兵在战斗中牺牲。","https://dict.youdao.com/dictvoice?type=1&audio=die","https://dict.youdao.com/dictvoice?type=2&audio=die"
"differ","['difə]","vi. 不同 (意见) 相异 不一致","Opinions differ on this topic.","关于这个话题，意见不一致。","https://dict.youdao.com/dictvoice?type=1&audio=differ","https://dict.youdao.com/dictvoice?type=2&audio=differ"
"difference","['difərəns]","n. 差别 差分 歧; vt. 引起区别","There is a big difference between them.","他们之间有很大的差别。","https://dict.youdao.com/dictvoice?type=1&audio=difference","https://dict.youdao.com/dictvoice?type=2&audio=difference"
"different","['difərənt]","adj. 差异的 各种的 不同的 与众不同的","We come from different countries.","我们来自不同的国家。","https://dict.youdao.com/dictvoice?type=1&audio=different","https://dict.youdao.com/dictvoice?type=2&audio=different"
"difficult","['difikəlt]","adj. 困难的 难对付的(人) 难取悦的 难相处的","This problem is very difficult.","这个问题非常困难。","https://dict.youdao.com/dictvoice?type=1&audio=difficult","https://dict.youdao.com/dictvoice?type=2&audio=difficult"
"difficulty","['difikəlti]","n. 困难 争议 反对 麻烦 难事 困境","She had difficulty completing the task.","她完成这项任务有困难。","https://dict.youdao.com/dictvoice?type=1&audio=difficulty","https://dict.youdao.com/dictvoice?type=2&audio=difficulty"
"dig","[dig]","vt. 掘 挖 翻土 采掘","They dig a hole in the garden.","他们在花园里挖一个洞。","https://dict.youdao.com/dictvoice?type=1&audio=dig","https://dict.youdao.com/dictvoice?type=2&audio=dig"
"digest","[dai'dʒest]","vt. 消化 领会 理解; vi. 消化; n. 文摘 摘要","It takes time to digest this information.","消化这些信息需要时间。","https://dict.youdao.com/dictvoice?type=1&audio=digest","https://dict.youdao.com/dictvoice?type=2&audio=digest"
"digital","['didʒitəl]","adj. 数字的 计数的 手指的 数码的 电子的","Digital cameras are very popular now.","数字相机现在非常流行。","https://dict.youdao.com/dictvoice?type=1&audio=digital","https://dict.youdao.com/dictvoice?type=2&audio=digital"
"diligent","['dilidʒənt]","adj. 勤勉的 勤奋的 用功的","She is a diligent student.","她是个勤奋的学生。","https://dict.youdao.com/dictvoice?type=1&audio=diligent","https://dict.youdao.com/dictvoice?type=2&audio=diligent"
"dim","[dim]","adj. 昏暗的 暗淡的 朦胧的 模糊的 笨的; vt. 使暗淡 使失去光泽; vi. 变暗; n. 车头灯的短焦距光","The light in the room was dim.","房间里的灯光昏暗。","https://dict.youdao.com/dictvoice?type=1&audio=dim","https://dict.youdao.com/dictvoice?type=2&audio=dim"
"dimension","[di'menʃən]","n. 尺寸 尺度 面积 次元 容积 维度 范围 方面; vt. 标尺寸 形成...尺寸","Check the dimensions of the table.","检查桌子的尺寸。","https://dict.youdao.com/dictvoice?type=1&audio=dimension","https://dict.youdao.com/dictvoice?type=2&audio=dimension"
"dinner","['dinə]","n. 正餐 主餐 宴会 晚宴","We had a delicious dinner last night.","我们昨晚吃了一顿美味的晚餐。","https://dict.youdao.com/dictvoice?type=1&audio=dinner","https://dict.youdao.com/dictvoice?type=2&audio=dinner"
"dip","[dip]","vt.浸 蘸 给...洗药浴; vi.浸一浸 下降 向下倾斜 翻阅 提取(款项); n.游 下降 减少 低洼处 调味酱 药浴液","He dipped the brush into the paint.","他把刷子浸入油漆中。","https://dict.youdao.com/dictvoice?type=1&audio=dip","https://dict.youdao.com/dictvoice?type=2&audio=dip"
"direct","[di'rekt]","adj.直接的 直率的 笔直的 坦白的; vt.指挥 命令 负责; vi.指导 指出","She directed the team during the project.","她在项目中指导团队。","https://dict.youdao.com/dictvoice?type=1&audio=direct","https://dict.youdao.com/dictvoice?type=2&audio=direct"
"direction","[di'rekʃən]","n.方向 方位 指导 用法说明 趋势","The compass shows the correct direction.","指南针显示正确的方向。","https://dict.youdao.com/dictvoice?type=1&audio=direction","https://dict.youdao.com/dictvoice?type=2&audio=direction"
"directly","[di'rektli]","adv.直接地 立即 完全","He arrived directly after the meeting.","他会后立即到达。","https://dict.youdao.com/dictvoice?type=1&audio=directly","https://dict.youdao.com/dictvoice?type=2&audio=directly"
"director","[di'rektə"," dai'rektə]","n.指导者 理事 董事 经理 主管 导演","The director of the company approved the plan.","公司董事批准了计划。","https://dict.youdao.com/dictvoice?type=2&audio=director"
"dirt","[də:t]","n.尘 土 污物 污垢 泥土 污秽的言行 卑鄙的人 堕落 矿渣","The child got dirt on his clothes while playing outside.","孩子在外面玩时弄脏了衣服。","https://dict.youdao.com/dictvoice?type=1&audio=dirt","https://dict.youdao.com/dictvoice?type=2&audio=dirt"
"dirty","['də:ti]","adj.脏的 下流的 肮脏的 色情的 卑鄙的; adv.卑鄙地; vt.使...变脏; vi.弄脏","The kitchen was dirty after the party.","聚会后厨房很脏。","https://dict.youdao.com/dictvoice?type=1&audio=dirty","https://dict.youdao.com/dictvoice?type=2&audio=dirty"
"disable","[dis'eibl]","vt.使无能 使伤残 使...失去能力","The accident disabled him temporarily.","事故使他暂时失去行动能力。","https://dict.youdao.com/dictvoice?type=1&audio=disable","https://dict.youdao.com/dictvoice?type=2&audio=disable"
"disadvantage","[.disəd'væntidʒ]","n.不利 不利地位 不利条件 损害 损失","Being new to the city was a disadvantage for him.","刚到这个城市对他来说是个不利条件。","https://dict.youdao.com/dictvoice?type=1&audio=disadvantage","https://dict.youdao.com/dictvoice?type=2&audio=disadvantage"
"disagree","[.disə'gri:]","vi.有分歧 不一致 不适应 不适宜","I disagree with your opinion.","我不同意你的看法。","https://dict.youdao.com/dictvoice?type=1&audio=disagree","https://dict.youdao.com/dictvoice?type=2&audio=disagree"
"disappear","[.disə'piə]","vi.不见 失踪 消失 灭绝; vt.引起消失","The magician made the rabbit disappear.","魔术师让兔子消失了。","https://dict.youdao.com/dictvoice?type=1&audio=disappear","https://dict.youdao.com/dictvoice?type=2&audio=disappear"
"disappoint","[.disə'pɔint]","vt.&vi.使失望 使受挫折","The results of the test disappointed the students.","考试结果让学生们失望。","https://dict.youdao.com/dictvoice?type=1&audio=disappoint","https://dict.youdao.com/dictvoice?type=2&audio=disappoint"
"disaster","[di'zɑ:stə]","n.灾难 灾祸 天灾","The earthquake was a major disaster.","地震是一场重大灾难。","https://dict.youdao.com/dictvoice?type=1&audio=disaster","https://dict.youdao.com/dictvoice?type=2&audio=disaster"
"disk","[disk]","n.圆盘 唱片 磁盘 光盘 花盘 盘形物 [计算机]磁盘; vt.用圆盘耙耙地","The computer stores data on a disk.","计算机将数据存储在磁盘上。","https://dict.youdao.com/dictvoice?type=1&audio=disk","https://dict.youdao.com/dictvoice?type=2&audio=disk"
"discard","['diskɑ:d,dis'kɑ:d]","vt.丢弃 抛弃 遗弃; vi.丢牌; n.丢牌 废牌","He discarded the old papers.","他丢弃了旧文件。","https://dict.youdao.com/dictvoice?type=1&audio=discard","https://dict.youdao.com/dictvoice?type=2&audio=discard"
"discharge","[dis'tʃɑ:dʒ]","vt.&vi.释放 排出 放出 解雇 解除 放电 清偿债务; n.释放 卸货 放电 一股 一阵 开火 发射 准许离开","The hospital discharged the patient after recovery.","病人康复后出院。","https://dict.youdao.com/dictvoice?type=1&audio=discharge","https://dict.youdao.com/dictvoice?type=2&audio=discharge"
"discipline","['disiplin]","n.纪律 训练 惩罚 学科; vt.训练 惩罚","Students must follow the school's discipline rules.","学生必须遵守学校的纪律规定。","https://dict.youdao.com/dictvoice?type=1&audio=discipline","https://dict.youdao.com/dictvoice?type=2&audio=discipline"
"disclose","[dis'kləuz]","vt.揭开 揭发 透露","The company disclosed its financial report.","公司披露了财务报告。","https://dict.youdao.com/dictvoice?type=1&audio=disclose","https://dict.youdao.com/dictvoice?type=2&audio=disclose"
"discourage","[dis'kʌridʒ]","vt.使泄气 使灰心 阻碍","Bad weather discouraged the hikers.","恶劣天气使登山者气馁。","https://dict.youdao.com/dictvoice?type=1&audio=discourage","https://dict.youdao.com/dictvoice?type=2&audio=discourage"
"discover","[dis'kʌvə]","vt.&vi.发现 暴露 显示","She discovered a new species of plant.","她发现了一种新植物。","https://dict.youdao.com/dictvoice?type=1&audio=discover","https://dict.youdao.com/dictvoice?type=2&audio=discover"
"discovery","[dis'kʌvəri]","n.发现 被发现的事物","The discovery of electricity changed the world.","电的发现改变了世界。","https://dict.youdao.com/dictvoice?type=1&audio=discovery","https://dict.youdao.com/dictvoice?type=2&audio=discovery"
"discuss","[di'skʌs]","vt.讨论 谈论 论述","We discussed the project for hours.","我们讨论了几个小时这个项目。","https://dict.youdao.com/dictvoice?type=1&audio=discuss","https://dict.youdao.com/dictvoice?type=2&audio=discuss"
"discussion","[di'skʌʃən]","n.讨论 谈论 辩论 论述","The discussion focused on climate change.","讨论集中在气候变化上。","https://dict.youdao.com/dictvoice?type=1&audio=discussion","https://dict.youdao.com/dictvoice?type=2&audio=discussion"
"disease","[di'zi:z]","n.病 疾病 病害 弊端","Smoking can lead to serious disease.","吸烟会导致严重疾病。","https://dict.youdao.com/dictvoice?type=1&audio=disease","https://dict.youdao.com/dictvoice?type=2&audio=disease"
"disguise","[dis'gaiz]","vi.隐瞒 掩埋; vt.假装 假扮 掩饰; n.假装 假面目 伪装物","He disguised himself as a waiter.","他伪装成服务员。","https://dict.youdao.com/dictvoice?type=1&audio=disguise","https://dict.youdao.com/dictvoice?type=2&audio=disguise"
"disgust","[dis'gʌst]","n.厌恶 憎恶 嫌恶; vt.&vi.令人厌恶","The smell of rotten food disgusted him.","腐烂食物的气味让他厌恶。","https://dict.youdao.com/dictvoice?type=1&audio=disgust","https://dict.youdao.com/dictvoice?type=2&audio=disgust"
"dish","[diʃ]","n.碟 盘子 菜肴 凹形; vt.装盘 提出 揭露 挖空; vi.闲谈","She served a delicious dish for dinner.","她晚餐端上了一道美味的菜。","https://dict.youdao.com/dictvoice?type=1&audio=dish","https://dict.youdao.com/dictvoice?type=2&audio=dish"
"dishonour","[dis'ɔnə]","n.不光彩 丢脸的人 耻辱; vt.使丢脸 侮辱 拒付","He faced dishonour after the scandal.","丑闻之后，他名誉扫地。","https://dict.youdao.com/dictvoice?type=1&audio=dishonour","https://dict.youdao.com/dictvoice?type=2&audio=dishonour"
"dislike","[dis'laik]","vt.&n.不喜爱 厌恶 反感","I dislike spicy food.","我不喜欢辣的食物。","https://dict.youdao.com/dictvoice?type=1&audio=dislike","https://dict.youdao.com/dictvoice?type=2&audio=dislike"
"dismiss","[dis'mis]","vt.不再考虑 解雇 解散 开除 逃避(法律) 驳回","The manager dismissed the employee for negligence.","经理因疏忽解雇了员工。","https://dict.youdao.com/dictvoice?type=1&audio=dismiss","https://dict.youdao.com/dictvoice?type=2&audio=dismiss"
"disorder","[dis'ɔ:də]","n.混乱 杂乱 骚乱; vt.扰乱","The sudden protest caused disorder in the street.","突如其来的抗议导致街道混乱。","https://dict.youdao.com/dictvoice?type=1&audio=disorder","https://dict.youdao.com/dictvoice?type=2&audio=disorder"
"display","[di'splei]","vt.陈列 展览 显示 炫耀; vt.显示 表现 夸示","The museum displays ancient artifacts.","博物馆陈列古代文物。","https://dict.youdao.com/dictvoice?type=1&audio=display","https://dict.youdao.com/dictvoice?type=2&audio=display"
"disposal","[di'spəuzəl]","n. 丢掉 处理 销毁 菜碾碎器","The disposal of waste is important for the environment.","废物处理对环境很重要。","https://dict.youdao.com/dictvoice?type=1&audio=disposal","https://dict.youdao.com/dictvoice?type=2&audio=disposal"
"dispose","[di'spəuz]","vi. 去掉 丢掉 销毁; vt. 倾向于 处置","He disposed of the old furniture.","他处理掉了旧家具。","https://dict.youdao.com/dictvoice?type=1&audio=dispose","https://dict.youdao.com/dictvoice?type=2&audio=dispose"
"displease","[dis'pli:z]","vt. 使不愉快 使生气","Her comment displeased everyone.","她的评论让大家都不高兴。","https://dict.youdao.com/dictvoice?type=1&audio=displease","https://dict.youdao.com/dictvoice?type=2&audio=displease"
"dispute","[di'spju:t]","vi. 争论 争执; vt. 争论 质疑 争夺 抵抗; n. 争论 争吵","The two countries disputed the border issue.","两国就边界问题发生争执。","https://dict.youdao.com/dictvoice?type=1&audio=dispute","https://dict.youdao.com/dictvoice?type=2&audio=dispute"
"dissatisfy","[dis'sætisfai]","vi. 使不满 使不平","The service will dissatisfy many customers.","这项服务会让许多顾客不满意。","https://dict.youdao.com/dictvoice?type=1&audio=dissatisfy","https://dict.youdao.com/dictvoice?type=2&audio=dissatisfy"
"dissolve","[di'zɔlv]","vt. 使溶解 解散 消除 解决(问题) 使沮丧; vi. 消散 溶解 解散 液化 变得模糊; n. 叠化画面","Sugar dissolves in water.","糖在水中溶解。","https://dict.youdao.com/dictvoice?type=1&audio=dissolve","https://dict.youdao.com/dictvoice?type=2&audio=dissolve"
"distance","['distəns]","n. 距离 间距 远处 (人际关系的)疏远; vt. 使疏远 把(对手)甩在后面 与...保持距离; adj. (通过电子手段)远程(教育)","Keep a safe distance from the car in front.","与前车保持安全距离。","https://dict.youdao.com/dictvoice?type=1&audio=distance","https://dict.youdao.com/dictvoice?type=2&audio=distance"
"distant","['distənt]","adj. 在远处的 疏远的 远房的 陌生的 远行的","He could see a distant mountain.","他能看到远处的山。","https://dict.youdao.com/dictvoice?type=1&audio=distant","https://dict.youdao.com/dictvoice?type=2&audio=distant"
"distinct","[di'stiŋkt]","adj. 与其他不同的 不同的 明显的 (from) 独特的 清楚的","There is a distinct difference between the two proposals.","这两个提案之间有明显差异。","https://dict.youdao.com/dictvoice?type=1&audio=distinct","https://dict.youdao.com/dictvoice?type=2&audio=distinct"
"distinction","[di'stiŋkʃən]","n. 差别 不同 区分 对比 杰出","She graduated with distinction.","她以优异成绩毕业。","https://dict.youdao.com/dictvoice?type=1&audio=distinction","https://dict.youdao.com/dictvoice?type=2&audio=distinction"
"distinguish","[di'stiŋgwiʃ]","vt. 区别 辨别 认别 特别关注; vi. 区别","It's hard to distinguish between the twins.","很难区分这对双胞胎。","https://dict.youdao.com/dictvoice?type=1&audio=distinguish","https://dict.youdao.com/dictvoice?type=2&audio=distinguish"
"distress","[di'stres]","n. 忧虑 悲伤 不幸 苦恼 贫困 忧郁 恶化 扣押财物; vt. 使...苦恼 仿造","She was in great distress after the accident.","事故后她非常痛苦。","https://dict.youdao.com/dictvoice?type=1&audio=distress","https://dict.youdao.com/dictvoice?type=2&audio=distress"
"distribute","[di'stribjut]","vt. & vi. 分发 分送 分布 分配","The volunteers distribute food to the needy.","志愿者分发食物给有需要的人。","https://dict.youdao.com/dictvoice?type=1&audio=distribute","https://dict.youdao.com/dictvoice?type=2&audio=distribute"
"distribution","[.distri'bju:ʃən]","n. 分发 分配 分布 散布","The distribution of resources is uneven.","资源分配不均。","https://dict.youdao.com/dictvoice?type=1&audio=distribution","https://dict.youdao.com/dictvoice?type=2&audio=distribution"
"district","['distrikt]","n. 区 地区 区域 行政区; vt. 划分区域 划分地区","The city is divided into several districts.","这座城市被划分为几个区域。","https://dict.youdao.com/dictvoice?type=1&audio=district","https://dict.youdao.com/dictvoice?type=2&audio=district"
"disturb","[dis'tə:b]","vt. & vi. 打扰 扰乱 弄乱 妨碍 使...不安","Please do not disturb the meeting.","请不要打扰会议。","https://dict.youdao.com/dictvoice?type=1&audio=disturb","https://dict.youdao.com/dictvoice?type=2&audio=disturb"
"ditch","[ditʃ]","n. 沟 沟渠 渠道; vt. 坠入沟中 摆脱 飞机(在海上)迫降; vi. 挖一条沟渠 飞机紧急降落","The car fell into a ditch.","汽车掉进了沟里。","https://dict.youdao.com/dictvoice?type=1&audio=ditch","https://dict.youdao.com/dictvoice?type=2&audio=ditch"
"dive","[daiv]","vi. 跳水 潜水 俯冲; vt. 跳水 俯冲; vi. 把...伸入","He dived into the pool.","他跳入了游泳池。","https://dict.youdao.com/dictvoice?type=1&audio=dive","https://dict.youdao.com/dictvoice?type=2&audio=dive"
"diverse","[dai'və:s]","adj. 不一样的 相异的 不同的 多种多样的","The city is known for its diverse culture.","这座城市以多样的文化闻名。","https://dict.youdao.com/dictvoice?type=1&audio=diverse","https://dict.youdao.com/dictvoice?type=2&audio=diverse"
"divide","[di'vaid]","vt. 分 分配 分开(组); vi. 除 分开","Divide the cake into four pieces.","把蛋糕分成四块。","https://dict.youdao.com/dictvoice?type=1&audio=divide","https://dict.youdao.com/dictvoice?type=2&audio=divide"
"division","[di'viʒən]","n. 分 分配 除法 划分 分开 部门 师(军队)","He works in the marketing division.","他在市场部工作。","https://dict.youdao.com/dictvoice?type=1&audio=division","https://dict.youdao.com/dictvoice?type=2&audio=division"
"divorce","[di'vɔ:s]","n. 离婚 离异; vi. 离婚 与...办离婚","They decided to get a divorce.","他们决定离婚。","https://dict.youdao.com/dictvoice?type=1&audio=divorce","https://dict.youdao.com/dictvoice?type=2&audio=divorce"
"do","[du:]","aux.v. vt. & vi. 做 干 办","I will do my homework.","我会做作业。","https://dict.youdao.com/dictvoice?type=1&audio=do","https://dict.youdao.com/dictvoice?type=2&audio=do"
"dock","[dɔk]","n. 船坞 码头 (造)修船厂 尾巴的骨肉部分 被告席; vt. 进港 (减)剪短 对接; vi. 进港 对接","The ship docked at the port.","船停靠在港口。","https://dict.youdao.com/dictvoice?type=1&audio=dock","https://dict.youdao.com/dictvoice?type=2&audio=dock"
"doctor","['dɔktə]","n. 医生 医师 博士; vt. 医治 篡改 对...做手脚; vi. 用药","She went to see a doctor.","她去看医生。","https://dict.youdao.com/dictvoice?type=1&audio=doctor","https://dict.youdao.com/dictvoice?type=2&audio=doctor"
"document","['dɔkjumənt, 'dɔkjument]","n. 公文 文件 证件 [计算机] 文档; vt. 记载 用文件等证明","Please document all your sources.","请记录下你所有的资料来源。","https://dict.youdao.com/dictvoice?type=1&audio=document","https://dict.youdao.com/dictvoice?type=2&audio=document"
"dog","[dɔg]","n. 狗 犬 犬科动物 卑鄙的人; vt. 尾随 跟踪","A dog followed us home.","一只狗跟着我们回家。","https://dict.youdao.com/dictvoice?type=1&audio=dog","https://dict.youdao.com/dictvoice?type=2&audio=dog"
"dollar","['dɔlə]","n. 美元(货币单位)","I exchanged euros for dollars.","我把欧元换成美元。","https://dict.youdao.com/dictvoice?type=1&audio=dollar","https://dict.youdao.com/dictvoice?type=2&audio=dollar"
"domestic","[də'mestik]","adj. 本国的 国内的 家庭的 驯养的; n. 家仆 佣人","She prefers domestic travel over international trips.","她更喜欢国内旅行而非出国旅行。","https://dict.youdao.com/dictvoice?type=1&audio=domestic","https://dict.youdao.com/dictvoice?type=2&audio=domestic"
"donkey","['dɔŋki]","n.驴 笨蛋","The donkey carried the heavy load up the hill.","驴把重物搬上了山坡。","https://dict.youdao.com/dictvoice?type=1&audio=donkey","https://dict.youdao.com/dictvoice?type=2&audio=donkey"
"door","[dɔ:]","n.门 通道 一家","Please close the door behind you.","请在你身后关上门。","https://dict.youdao.com/dictvoice?type=1&audio=door","https://dict.youdao.com/dictvoice?type=2&audio=door"
"dorm","[dɔ:m]","n.(集体)宿舍","He lives in a dorm near the university.","他住在大学附近的宿舍里。","https://dict.youdao.com/dictvoice?type=1&audio=dorm","https://dict.youdao.com/dictvoice?type=2&audio=dorm"
"dormitory","['dɔ:mitri]","n.集体寝室 宿舍","The dormitory has shared bathrooms.","宿舍有共用浴室。","https://dict.youdao.com/dictvoice?type=1&audio=dormitory","https://dict.youdao.com/dictvoice?type=2&audio=dormitory"
"dose","[dəus]","n.剂量 用量 一剂; vt.配","Take one dose of medicine twice a day.","每天服用一剂药，两次。","https://dict.youdao.com/dictvoice?type=1&audio=dose","https://dict.youdao.com/dictvoice?type=2&audio=dose"
"dot","[dɔt]","n.点 圆点 少量 小东西; vt.作小点记号 点缀; vi.作小点记号 [计算机] 点","She added a dot to the map to mark the location.","她在地图上加了一个点标记位置。","https://dict.youdao.com/dictvoice?type=1&audio=dot","https://dict.youdao.com/dictvoice?type=2&audio=dot"
"double","['dʌbl]","adj.两倍的 复制品 替身 双重角色的演员 双的 双人房; adv. 两倍地 双人地 翻来覆去地 对折地; vt.使加倍 对折 握紧 做替身; vi.加倍 转身 兼任 替代演出","He earns double his previous salary now.","他现在的收入是以前的两倍。","https://dict.youdao.com/dictvoice?type=1&audio=double","https://dict.youdao.com/dictvoice?type=2&audio=double"
"doubt","[daut]","n.怀疑 疑虑 不信任; vt.怀疑 不信任; vi.不确定","I have some doubt about the accuracy of this report.","我对这份报告的准确性有些怀疑。","https://dict.youdao.com/dictvoice?type=1&audio=doubt","https://dict.youdao.com/dictvoice?type=2&audio=doubt"
"doubtful","['dautfəl]","adj.难以预测的 怀疑的 疑心的 不确定的","The weather is doubtful for tomorrow.","明天的天气不确定。","https://dict.youdao.com/dictvoice?type=1&audio=doubtful","https://dict.youdao.com/dictvoice?type=2&audio=doubtful"
"doubtless","['dautlis]","adv.无疑地 很可能 确定地; adj.无疑的 确定的","He is doubtless the best candidate for the job.","他无疑是这份工作的最佳人选。","https://dict.youdao.com/dictvoice?type=1&audio=doubtless","https://dict.youdao.com/dictvoice?type=2&audio=doubtless"
"down","[daun]","adv.向下 在下面 下跌 在南方; adj.向下的 降低的 情绪低落 停止运行; n.绒毛 汗毛 轻视; prep.沿着...而下","The ball rolled down the hill.","球滚下了山坡。","https://dict.youdao.com/dictvoice?type=1&audio=down","https://dict.youdao.com/dictvoice?type=2&audio=down"
"downstairs","[.daun'stɛəz]","adv.在楼下 向楼下; adj.楼下的; n.楼下","He went downstairs to answer the phone.","他下楼去接电话。","https://dict.youdao.com/dictvoice?type=1&audio=downstairs","https://dict.youdao.com/dictvoice?type=2&audio=downstairs"
"downward","['daunwəd]","adj.向下的; adv.向下地","The economy is on a downward trend.","经济处于下行趋势。","https://dict.youdao.com/dictvoice?type=1&audio=downward","https://dict.youdao.com/dictvoice?type=2&audio=downward"
"dozen","['dʌzn]","n.一打 十二个; adj.一打的 十二个的","I bought a dozen eggs from the market.","我从市场买了一打鸡蛋。","https://dict.youdao.com/dictvoice?type=1&audio=dozen","https://dict.youdao.com/dictvoice?type=2&audio=dozen"
"draft","[dræft]","n.草稿 草图 汇票 徴兵; vt.起草 征兵 选秀; adj.酝酿中的","He prepared a draft of the report.","他准备了报告草稿。","https://dict.youdao.com/dictvoice?type=1&audio=draft","https://dict.youdao.com/dictvoice?type=2&audio=draft"
"drag","[dræg]","vt.拖 拉 拖曳 拖累 拖拉(动); vi.拖拉(动) 缓慢地行走; n.用来拖拉的东西 拖 拖累","She had to drag the suitcase up the stairs.","她不得不把行李箱拖上楼梯。","https://dict.youdao.com/dictvoice?type=1&audio=drag","https://dict.youdao.com/dictvoice?type=2&audio=drag"
"dragon","['drægən]","n.龙 凶暴的人 严厉的人","The dragon guarded the treasure in the story.","故事里的龙守护着宝藏。","https://dict.youdao.com/dictvoice?type=1&audio=dragon","https://dict.youdao.com/dictvoice?type=2&audio=dragon"
"drain","[drein]","vt.排去 放水 耗尽 排出 排干 喝光; vi.变干 排出 排水; n.下水道 排水沟 消耗 耗竭","Water drained slowly from the sink.","水慢慢从水槽排掉。","https://dict.youdao.com/dictvoice?type=1&audio=drain","https://dict.youdao.com/dictvoice?type=2&audio=drain"
"drama","['drɑ:mə]","n.一出戏剧 剧本 戏剧 戏剧性情节 刺激","The play is a classic drama.","这部剧是一部经典戏剧。","https://dict.youdao.com/dictvoice?type=1&audio=drama","https://dict.youdao.com/dictvoice?type=2&audio=drama"
"dramatic","[drə'mætik]","adj.引人注目的 戏剧的 给人深刻印象的; n.(pl.)戏剧作品 戏曲","The sunset was a dramatic sight.","落日景象非常壮观。","https://dict.youdao.com/dictvoice?type=1&audio=dramatic","https://dict.youdao.com/dictvoice?type=2&audio=dramatic"
